<?xml version="1.0" encoding="UTF-8"?>
<tns:offering xmlns:tns="http://pcom.redknee.com/om/itemType" xmlns:xsi="http://www.w3.org/2001/XMLSchema-instance" xsi:schemaLocation="http://pcom.redknee.com/om/itemType modifySoldOfferings.xsd ">
  <offeringInstance businessKey="" name="">
    <subscriptionIdentifier>subscriptionIdentifier</subscriptionIdentifier>
    <spid>spid</spid>
    <subscriptionType>
      <name>name</name>
    </subscriptionType>
    <paidType>paidType</paidType>
    <pickupDate>2001-01-01</pickupDate>
    <deliveryMethod>deliveryMethod</deliveryMethod>
    <contractBusinessKey>contractBusinessKey</contractBusinessKey>
    <price>
      <oneTimeCharge>
        <upfrontIndicator>upfrontIndicator</upfrontIndicator>
        <chargeTemplateBusinessKey>chargeTemplateBusinessKey</chargeTemplateBusinessKey>
        <chargeValue>0.0</chargeValue>
        <productChargeValue>0.0</productChargeValue>
        <taxValue>0.0</taxValue>
        <overriddenValue>0.0</overriddenValue>
        <chargeAlteration>0.0</chargeAlteration>
        <monthlyCancellationFee>0.0</monthlyCancellationFee>
      </oneTimeCharge>
      <recurringCharge>
        <chargeValue>0.0</chargeValue>
        <frequency>frequency</frequency>
        <productChargeValue>0.0</productChargeValue>
        <validFor>1</validFor>
        <overriddenValue>0.0</overriddenValue>
      </recurringCharge>
      <deposit>
        <depositId>0</depositId>
        <type>0</type>
        <value>0.0</value>
        <overriddenValue>0.0</overriddenValue>
      </deposit>
      <discounts>
        <discount>
          <identifier>identifier</identifier>
          <value>0.0</value>
          <valueType>valueType</valueType>
          <disocuntType>disocuntType</disocuntType>
          <frequency>frequency</frequency>
        </discount>
      </discounts>
    </price>
    <product>
      <packageProduct actionInd="add" businessKey="" name="">
        <productType>service</productType>
        <characteristics>
          <characteristic businessKey="" name="">
            <value>value</value>
          </characteristic>
        </characteristics>
        <price>
          <oneTimeCharge>
            <upfrontIndicator>upfrontIndicator</upfrontIndicator>
            <chargeTemplateBusinessKey>chargeTemplateBusinessKey</chargeTemplateBusinessKey>
            <chargeValue>0.0</chargeValue>
            <productChargeValue>0.0</productChargeValue>
            <taxValue>0.0</taxValue>
            <overriddenValue>0.0</overriddenValue>
            <chargeAlteration>0.0</chargeAlteration>
            <monthlyCancellationFee>0.0</monthlyCancellationFee>
          </oneTimeCharge>
          <recurringCharge>
            <chargeValue>0.0</chargeValue>
            <frequency>frequency</frequency>
            <productChargeValue>0.0</productChargeValue>
            <validFor>1</validFor>
            <overriddenValue>0.0</overriddenValue>
          </recurringCharge>
          <deposit>
            <depositId>0</depositId>
            <type>0</type>
            <value>0.0</value>
            <overriddenValue>0.0</overriddenValue>
          </deposit>
          <discounts>
            <discount>
              <identifier>identifier</identifier>
              <value>0.0</value>
              <valueType>valueType</valueType>
              <disocuntType>disocuntType</disocuntType>
              <frequency>frequency</frequency>
            </discount>
          </discounts>
        </price>
        <path>path</path>
        <products>
          <product/>
        </products>
      </packageProduct>
    </product>
    <extensions>
      <extension businessKey="" name="">
        <value>value</value>
      </extension>
    </extensions>
    <reason>reason</reason>
  </offeringInstance>
</tns:offering>
